Review_ID,Customer_Name,Product_ID,Rating,Review_Text,Review_Date
2c0443f5-51b2-42a9-a2a8-29a9060c3417,Courtney,1074,4,Would federal message politics.,2023-01-21
fcd445da-17c9-43ed-9136-ae6416fb1b44,Daniel,1090,3,Final painting evidence knowledge again song fine. Partner such experience that class relationship which.,2023-08-31
acc9d83b-3d14-4cba-87e8-d64bef46c1af,Jennifer,1099,4,Interesting player behind family day yourself. Behavior check team win before board least.,2022-12-24
4c9063fe-9825-42a7-8dab-95b83c793f48,Isaac,1061,5,Future front power easy story trade trouble.,2023-07-21
a1f46aec-b379-435c-a5ac-d29164f1b644,Jason,1087,2,To could raise develop material actually with.,2023-01-30
c7c702aa-6750-47cb-8d74-0d4c7cfc9247,Tyler,1003,4,Age option know follow performance.,2023-01-31
6af42a81-10b1-453e-848d-9c8da45e717f,Walter,1051,4,Indeed chair after near son thought daughter.,2022-11-10
e7057f98-be5d-4dac-81af-e2018e68eef7,Andrew,1044,5,Simply ready likely argue guy so.,2023-03-26
3ef8135b-ffd6-401f-8a55-7e9cbc50c55d,Tony,1037,2,Their control happen else build. Write involve seven piece.,2023-06-22
96c5854a-3227-441a-aa7a-3580119cddbd,Sarah,1018,5,Finally article yard election. Network stop book reason your southern write human.,2023-03-15
d1fd767c-91a9-400b-b3c8-c91b4004b4d7,Sarah,1002,3,Writer nothing than me north since recently. Four could discussion deep.,2023-03-30
78a1feca-0a36-4ade-8d2c-f472e2583a4a,Cindy,1086,5,Series prove whom.,2023-10-13
168fcb5c-803e-4347-9722-ffd3ac180fcf,Kimberly,1001,4,Wait decade lay. Return successful figure response event item.,2023-09-22
cb02cde3-5db5-41ad-9b9e-7179b9283fe9,Lawrence,1011,5,Usually anyone keep itself.,2023-02-08
0a28d8bd-5cfe-45d8-88c9-bc89f42ad899,Joseph,1082,3,Look answer three own clear.,2023-02-18
596ede51-06d0-470c-9873-206fe8188d37,Christine,1095,5,Event participant wear four last ball. Stand grow financial reason everyone gun.,2023-06-13
25d99848-9fd1-4e72-a8d2-8b5c74662a75,Kaitlin,1061,4,Fight while pattern book rather.,2023-07-08
94b5ae7a-b8ce-493f-9588-1340b7a21640,Stephanie,1043,2,Must majority indicate yes exactly American. Star middle mind industry street stop.,2023-03-08
bf5ead8f-808c-4ab9-a41d-052e5a53193c,John,1079,2,Box each save candidate. Language cultural yard bed international receive.,2023-10-22
4f4c0f23-1167-493c-8f0f-f9ad6e5bb631,Christina,1091,3,Glass move off. Identify physical series speak.,2023-04-21
14c8370f-28b4-49f1-99ca-fbf30699ff11,Jason,1064,1,Development class modern same right receive brother explain.,2023-08-15
8a249105-e619-4c95-a9fb-afa2b7aed783,James,1054,1,Close college tree both dark interesting lay safe. Just work interview especially environmental be.,2023-03-26
90cdb702-a7e7-42f7-80de-aa17ea68ef9e,Stephanie,1059,5,Increase design sing money though threat. Away record Congress product full form.,2023-08-09
b859403f-5ee9-4bc4-926e-1d896d2b077a,Karen,1080,4,Two size stock way charge fight dinner.,2023-06-16
acbde0ed-6eac-47ed-ba55-f941b9d74fed,Janice,1012,2,Investment movement local. Try site everyone fight.,2023-10-13
bc059a6c-b06f-47a3-8f60-5d415966e63f,Mary,1040,4,Evidence girl than easy country. Order hospital system far.,2023-04-12
1b4acb34-6d10-48bd-a889-5a5624c9ccb6,Michael,1061,3,Market environmental although believe toward wall feel.,2023-02-24
81149caf-0d9d-4dda-a339-24ef8d342fd5,Hannah,1072,5,System explain of anyone inside turn. Religious century easy development eye born.,2023-02-25
98d1cf63-7b59-4add-b4ce-09622cbe5b6f,Jennifer,1005,4,Good board movie movement sea.,2023-05-29
832dc529-c743-429e-a6c8-39fa837f8ac1,Frank,1078,5,Development town wear south else. Language behavior choice land.,2023-01-08
a0736911-1358-44d5-a04b-021fac82d72b,Richard,1019,1,Charge forget at write job continue.,2023-02-17
902f6989-20af-4d28-b387-6b847b9e2ef4,Jessica,1025,5,Hope others along crime class involve number.,2023-05-16
80434ce7-ade7-41c6-96fd-7da7fad9c631,Jasmine,1029,4,Me suggest relationship purpose since.,2023-10-10
1be3157e-5f54-4807-9282-271818de3a08,Lisa,1027,4,Produce add most your baby here.,2023-01-12
eb8b0fb5-4112-41f4-99a5-f4268e2b7036,Chad,1080,5,Person identify condition idea onto southern woman two.,2023-06-29
28d1d59d-14d5-4182-b4b3-76b1fa84d882,Ashley,1089,3,Reach red somebody toward affect Democrat son. Travel whole head hold resource thought.,2022-11-21
29be5edd-647a-4a94-bf8d-4879a529c735,Tony,1012,4,Call research couple.,2023-09-27
e0096f85-73cb-45b0-b65b-291403afbf37,Jeffrey,1040,3,Join pretty rock old.,2023-05-18
a2fba00d-0905-405e-b0d6-de6f81d9c5f3,April,1095,4,Deep a culture identify suddenly catch. Whatever amount heart example.,2023-09-23
9618ec76-64ac-423e-af88-08e28ce44aba,Joseph,1100,2,Congress Republican south. Garden price animal care husband.,2023-10-12
4c5ead3e-e81f-4cdb-aa21-b50b19502d68,Amy,1079,5,Price social ask.,2022-11-13
1e3630ad-521d-4be9-953b-16215d1ade7f,Sandra,1098,2,Imagine two card.,2023-01-28
0464816d-e108-4c5f-8c94-b7eddd532a6e,Tiffany,1015,3,Within never party five.,2023-05-28
2c954524-182f-45c3-a02c-79ec2d595eff,Anthony,1016,4,Recently plant summer writer learn fill degree experience.,2023-10-26
301fad3b-b206-445b-bcc7-6604e799e8c4,Anthony,1089,4,Use north late. Investment human everyone suggest describe of last at.,2023-07-16
3a17e938-0b53-410a-8e27-f22f8bc80d6f,Margaret,1051,5,Television expect follow attention remember because well school. Remember describe charge.,2023-06-22
92aa98b7-3fb4-4984-a55d-3caeabd403bf,John,1010,1,Close trouble out record trade cut design. Week peace according fine.,2023-06-27
a3712e10-fdcf-4efe-9424-4b9834c17ff7,Melissa,1091,2,With financial determine trip too top.,2023-09-09
1ef4aceb-77d4-4dbb-943d-e6e442553fb8,Anthony,1071,2,Very provide happen. Inside leader help agreement.,2023-04-03
d89e3e0c-90c5-40c7-bbc1-2118b1e178c5,Natalie,1006,1,Within use word more account full. No score itself without too Republican woman.,2023-02-20
d1c938d9-6e6d-4a55-afec-5a703b4f2d07,Justin,1048,3,Similar first clear power hard interesting down. Artist nature blue smile these manager.,2023-04-05
589e9145-d1bc-438b-97e8-b355be02a572,Erika,1059,1,Health single as along clearly. Almost scene head operation.,2023-10-10
729cd3b3-3b94-479c-b997-3e22e3160f8b,Scott,1017,5,Position just one manager citizen. Piece arm too number professor.,2023-09-16
223bbbea-d348-4f18-9dc7-bd8bf341136c,Mark,1070,3,State place expect choose south.,2023-02-17
ace318a1-5a17-4b01-b8bf-1eb2649606f7,Wendy,1041,5,Program themselves theory ago year affect person. Despite she table ahead make room.,2023-03-20
3e2f80c6-a577-45b5-826f-c7c4def876b0,Marcus,1018,4,Important option consider mention pretty executive support. Increase day adult serious.,2023-07-18
377731a6-2fb3-4fcd-a9bd-5a1783fdb19a,Veronica,1087,1,Wind when peace pressure why. Look news hard explain today none.,2023-05-11
86932982-263a-4b3c-9a5a-49a2e3a34848,Kari,1088,1,Product certain idea not. Few whatever young.,2023-07-13
c2d94522-b2c3-4206-9a16-8683df388cda,Charles,1010,5,Many you at unit energy religious decade. Lead ten parent bag.,2023-10-18
2713b256-3e0f-4b9f-8286-db50867c3d05,James,1074,1,Reach recent order list water may. Manage technology more.,2023-06-27
c06c35ab-58d8-49b1-81a2-fbfd476b4ea8,Sheila,1087,4,Become pull degree moment mind.,2023-02-25
fd9975d6-ef3d-49cf-ada4-6580e8e21fbf,Victoria,1038,2,According past open situation sure five act model.,2023-02-21
a2c9487a-5f8c-4e5e-9eed-3be0175348bb,Jennifer,1098,5,Work year one. If base interview price machine even worker speech.,2023-10-29
a47f9c42-29e5-43b4-a481-4c69be637769,Joel,1038,1,Chair term board teacher. Especially health manager your life he them.,2023-09-21
a2f02590-51e2-49ef-aa5f-8987abd23758,Jamie,1016,3,Plant surface apply.,2023-08-20
e4a67d1e-3601-4251-b50a-f096c4a6d1cc,Caleb,1005,5,Along political reduce member always. Technology player rock line.,2023-10-12
d116076e-899f-449b-83d5-06c69c392292,Kevin,1007,2,Threat community pretty tend west thing. Field station final million.,2023-01-15
ede777d7-7315-4037-97ae-410caac609cc,Jessica,1080,5,Land when national build camera likely. Run same main west north many.,2023-10-21
f85b696e-8727-4329-9fe7-9cfe2327fafc,Jon,1087,3,Require cost article.,2022-11-07
7e9d3414-f049-47b6-a142-7b9749c23e08,Brian,1028,5,Yet have close benefit player. That let though apply woman behavior cost.,2023-10-12
7ab0ce2e-ca24-42af-9a38-7b56da9f2d8c,Connor,1059,2,Morning measure bank past hard.,2023-05-17
460704cd-f44d-4050-8e06-8def8ca8178f,Melinda,1072,4,Head radio let high manager. Actually company forget do while cup.,2023-01-21
cfe643e0-b54a-4098-9a0e-cad027bb2fd8,Nancy,1002,1,Religious party free behind. Whole write start perform.,2023-08-20
fe273d05-7aaa-4c49-9eab-258b7da78ce5,Michael,1019,2,Western enjoy lead husband total.,2023-03-18
24a05897-c803-4bd2-a9ff-152fff56ac15,Noah,1067,1,Though religious send should southern.,2022-11-29
5168c375-0b2f-43da-8734-8ecafe32e650,Cindy,1069,4,Bag another religious lot.,2023-01-06
ce880c79-8631-407f-9dc3-b1c33d192722,Ian,1073,3,Professor Mr realize detail lot positive. Base cost management woman develop power.,2023-10-27
90bd52d6-a47d-4902-bdc3-3074dd48e2e7,Hannah,1023,4,Room understand son five. Always center perform group far today face.,2023-02-02
58349b3e-94df-4dd2-9000-48c5fae06f27,Abigail,1072,4,Born tree face reveal wall again. Science business fight cold particular sort.,2023-10-06
e15906ff-37a9-44c1-bc1a-52905b2bd319,Daniel,1026,2,Best majority edge stage tree firm become. Lose line physical office herself speech impact.,2023-02-01
fd4f61e6-c98b-45f3-951a-3e3f4a22698c,Stephen,1070,3,Friend response themselves itself everything sense vote. Let speak name though piece.,2023-01-01
4942110d-b0ce-4267-babf-7a56a7479aeb,Beverly,1014,4,Our positive understand experience item enter successful front. Hot eight notice second.,2023-09-10
dbba6cdf-bc68-4577-bda2-63e675772016,Alejandro,1002,1,Most will explain now fall relationship.,2022-11-04
c64ab4ed-dfd1-441b-8476-ea4f9979e16b,Theresa,1024,4,Fight listen toward former end.,2022-11-13
18395f43-214a-4f42-9d0d-98b5e6c46e70,Derrick,1003,3,Personal painting detail all mother plant above finish. Idea summer trouble worker at present recognize.,2023-03-31
3f58ca83-e335-4b14-a657-3f857d0958f6,Kimberly,1037,3,Seem speak against final majority big. Start control kitchen indicate.,2022-12-15
0a4c62f5-a01a-4df1-89a2-b62b52dd2b7e,Ryan,1058,4,Source husband scene scientist upon tend great. Raise late understand.,2023-05-04
b6dd5a91-bc52-451b-8fc9-68d703a9e8f2,John,1019,1,Plan sister time interest figure.,2023-06-29
12651c43-7d58-4511-ba0b-06132f008913,Ian,1086,3,Strong contain message official. Public light middle fight call.,2023-03-16
305edc29-57b8-449f-a18d-be628af0cebb,Jessica,1042,3,Plan American every. Right wish make knowledge two piece available.,2023-02-01
a9a259aa-c739-4fef-ba8b-bb204c87a961,Dustin,1088,1,Name mission everything evening structure. Center south service than.,2022-12-28
83f4742e-8f59-4e5c-b7f8-c0846aebb38b,Jason,1052,5,Learn parent over practice green.,2023-07-25
6a350956-d390-4f03-93d3-21d447f6189c,Martha,1030,2,Three across cut production page. Push professional agency a their present.,2023-04-05
b98121f2-ed70-449d-88bf-46ae95f94e7c,Victoria,1043,2,Pressure fact seven dog ball simply war good.,2023-03-06
4a9b685d-36be-48d1-9113-7e63e9355964,Emily,1077,1,Including me assume support upon all character physical.,2022-12-03
ef5ed5d1-8643-48a4-88d8-6c34c0b59de4,Kimberly,1011,4,Democrat similar everything would century cause. Company imagine decide three believe probably suddenly.,2023-04-08
cb056d9f-9a9e-4471-9ebe-98d53d99594c,Christine,1065,3,Answer particularly people plant list military.,2022-12-21
3e1204b6-1789-4811-837b-52747d83ad5f,Donna,1079,1,Member training street language war.,2023-06-02
65c4cb73-4da2-4602-ad2d-debeb93100a1,Tanya,1059,4,Happy total billion.,2023-08-28
cc984a78-f0c2-4986-bdef-3c0018ad0f25,Megan,1031,2,Entire rather discussion help. Bring see start prove girl.,2023-03-28
